{
  "$schema": "https://conventionalbranch.org/schema/v1/spec.schema.json",
  "spec": "Conventional Branch",
  "version": "1.2.0",
  "url": "https://conventionalbranch.org",
  "license": "CC-BY-4.0",
  "separator": "/",
  "trunkBranches": ["main", "master", "develop"],
  "types": [
    {
      "type": "feature",
      "aliases": ["feat"],
      "category": "purpose",
      "description": "New features"
    },
    {
      "type": "bugfix",
      "aliases": ["fix"],
      "category": "purpose",
      "description": "Bug fixes"
    },
    {
      "type": "hotfix",
      "aliases": [],
      "category": "purpose",
      "description": "Urgent production fixes"
    },
    {
      "type": "release",
      "aliases": [],
      "category": "purpose",
      "description": "Release preparation"
    },
    {
      "type": "chore",
      "aliases": [],
      "category": "purpose",
      "description": "Non-code tasks (dependencies, docs, config)"
    },
    {
      "type": "ai",
      "aliases": [],
      "category": "ai-source",
      "description": "Generic prefix for any AI coding agent"
    },
    {
      "type": "claude",
      "aliases": [],
      "category": "ai-source",
      "description": "Claude Code by Anthropic"
    },
    {
      "type": "codex",
      "aliases": [],
      "category": "ai-source",
      "description": "OpenAI Codex"
    },
    {
      "type": "copilot",
      "aliases": [],
      "category": "ai-source",
      "description": "GitHub Copilot"
    },
    {
      "type": "cursor",
      "aliases": [],
      "category": "ai-source",
      "description": "Cursor"
    }
  ],
  "rules": {
    "case": "lowercase",
    "descriptionAllowedCharacters": ["a-z", "0-9", "-", "."],
    "noConsecutiveSeparators": true,
    "noLeadingOrTrailingSeparators": true,
    "ticketKey": "[A-Z][A-Z0-9]*-[0-9]+",
    "notes": "The type is one of the fixed values in `types`, joined to the description by the `separator` (\"/\"). `descriptionAllowedCharacters` applies to the description only and does not include the separator. Hyphens separate words in the description; dots are typically used for version numbers (e.g. release/v1.2.0). The description is lowercase with one exception: it may open with a ticket key matching `ticketKey` (e.g. feature/PROJ-123-new-login), which keeps its uppercase form. Trunk branches do not use a prefix. `grammar.regex` is the authoritative validator."
  },
  "grammar": {
    "abnf": "branch-name = trunk-branch / prefixed-branch\ntrunk-branch = \"main\" / \"master\" / \"develop\"\nprefixed-branch = type \"/\" description\ntype = \"feature\" / \"feat\" / \"bugfix\" / \"fix\" / \"hotfix\" / \"release\" / \"chore\" / \"ai\" / \"copilot\" / \"cursor\" / \"claude\" / \"codex\"\ndescription = (ticket-key / desc-segment) *(\"-\" desc-segment)\nticket-key = UPPER *(UPPER / DIGIT) \"-\" 1*DIGIT\ndesc-segment = 1*(ALPHA / DIGIT) *(\".\" 1*(ALPHA / DIGIT))\nALPHA = %x61-7A\nUPPER = %x41-5A\nDIGIT = %x30-39",
    "regex": "^(?:main|master|develop|(?:feature|feat|bugfix|fix|hotfix|release|chore|ai|copilot|cursor|claude|codex)/(?:[A-Z][A-Z0-9]*-[0-9]+|[a-z0-9]+(?:\\.[a-z0-9]+)*)(?:-[a-z0-9]+(?:\\.[a-z0-9]+)*)*)$"
  }
}
